[
  {
    "title": "2048 Game",
    "category": "games",
    "path": "projects/games/2048-game/",
    "dateAdded": "2026-07-17T19:22:24+05:30",
    "thumbnailHash": "e6aec8e6"
  },
  {
    "title": "Advanced QR Code Generator",
    "category": "productivity",
    "path": "projects/productivity/advanced-qr-code-generator/",
    "dateAdded": "2026-07-23T23:01:17+05:30",
    "thumbnailHash": "2f496125"
  },
  {
    "title": "AI Circuit Builder",
    "category": "aiml",
    "path": "projects/aiml/ai-circuit-builder/",
    "dateAdded": "2026-06-18T12:02:12+05:30",
    "thumbnailHash": "33cc850b"
  },
  {
    "title": "API Response Inspector",
    "category": "dev-tools",
    "path": "projects/dev-tools/api-response-inspector/",
    "dateAdded": "2026-08-15T15:04:05+05:30",
    "thumbnailHash": "4115bc62"
  },
  {
    "title": "ASCII Camera",
    "category": "misc",
    "path": "projects/misc/ascii-camera/",
    "dateAdded": "2026-07-25T23:12:06+05:30",
    "thumbnailHash": "e5f52607"
  },
  {
    "title": "Attendance Tracker",
    "category": "productivity",
    "path": "projects/productivity/attendance-tracker/",
    "dateAdded": "2026-06-18T12:02:12+05:30",
    "thumbnailHash": "ef65c8f4"
  },
  {
    "title": "Audio Spectrogram Analyzer",
    "category": "misc",
    "path": "projects/misc/audio-spectrogram-analyzer/",
    "dateAdded": "2026-08-31T12:46:36Z",
    "thumbnailHash": "552f0120"
  },
  {
    "title": "Audio Waveform Generator",
    "category": "misc",
    "path": "projects/misc/audio-waveform-generator/",
    "dateAdded": "2026-07-27T16:44:21+05:30",
    "thumbnailHash": "914fef11"
  },
  {
    "title": "Avatar Creator",
    "category": "misc",
    "path": "projects/misc/avatar-creator/",
    "dateAdded": "2026-07-27T19:18:19+05:30",
    "thumbnailHash": "ad86d2f6"
  },
  {
    "title": "Brain Dump Collector",
    "category": "productivity",
    "path": "projects/productivity/brain-dump-collector/",
    "dateAdded": "2026-07-23T22:27:35+05:30",
    "thumbnailHash": "7f2aa5c0"
  },
  {
    "title": "Browser Storage Inspector",
    "category": "dev-tools",
    "path": "projects/dev-tools/browser-storage-inspector/",
    "dateAdded": "2026-07-23T22:19:33+05:30",
    "thumbnailHash": "de32180e"
  },
  {
    "title": "Cannon Shooting",
    "category": "games",
    "path": "projects/games/cannon-shooting/",
    "dateAdded": "2026-07-08T13:33:11+05:30",
    "thumbnailHash": "7b574e33"
  },
  {
    "title": "Chess",
    "category": "games",
    "path": "projects/games/chess/",
    "dateAdded": "2026-06-18T12:02:12+05:30",
    "thumbnailHash": "4f183793"
  },
  {
    "title": "Collaborative Whiteboard",
    "category": "misc",
    "path": "projects/misc/collaborative-whiteboard/",
    "dateAdded": "2026-08-31T12:21:19Z",
    "thumbnailHash": "1bf26a9d"
  },
  {
    "title": "Color Contrast Checker",
    "category": "dev-tools",
    "path": "projects/dev-tools/color-contrast-checker/",
    "dateAdded": "2026-08-07T23:15:16+05:30",
    "thumbnailHash": "ae0f4698"
  },
  {
    "title": "Color Palette Generator",
    "category": "editor",
    "path": "projects/editor/color-palette-generator/",
    "dateAdded": "2026-08-30T05:41:31+05:30",
    "thumbnailHash": "07385801"
  },
  {
    "title": "CPU Emulator",
    "category": "dev-tools",
    "path": "projects/dev-tools/cpu-emulator/",
    "dateAdded": "2026-06-18T12:02:12+05:30",
    "thumbnailHash": "2d562d77"
  },
  {
    "title": "CSS Clamp Calculator",
    "category": "dev-tools",
    "path": "projects/dev-tools/css-clamp-calculator/",
    "dateAdded": "2026-08-07T23:54:44+05:30",
    "thumbnailHash": "1403cb5f"
  },
  {
    "title": "CSS Gradient Generator",
    "category": "editor",
    "path": "projects/editor/css-gradient-generator/",
    "dateAdded": "2026-08-30T05:49:18+05:30",
    "thumbnailHash": "f6a8ddb7"
  },
  {
    "title": "CSS Grid Generator",
    "category": "dev-tools",
    "path": "projects/dev-tools/css-grid-generator/",
    "dateAdded": "2026-08-29T16:33:09+05:30",
    "thumbnailHash": "49bc3202"
  },
  {
    "title": "CSS Shape Designer",
    "category": "editor",
    "path": "projects/editor/css-shape-designer/",
    "dateAdded": "2026-07-25T09:18:49+05:30",
    "thumbnailHash": "7dfbe624"
  },
  {
    "title": "CSV Data Cleaner",
    "category": "file-tools",
    "path": "projects/file-tools/csv-data-cleaner/",
    "dateAdded": "2026-08-07T23:13:17+05:30",
    "thumbnailHash": "9a41ca34"
  },
  {
    "title": "Cyberpunk Pixel Art Generator",
    "category": "misc",
    "path": "projects/misc/cyberpunk-pixel-art-generator/",
    "dateAdded": "2026-08-29T18:55:02+05:30",
    "thumbnailHash": "86b00fe0"
  },
  {
    "title": "Dot Game",
    "category": "games",
    "path": "projects/games/dot-game/",
    "dateAdded": "2026-06-19T14:31:47+05:30",
    "thumbnailHash": "9cf96f5d"
  },
  {
    "title": "Encoding Toolkit",
    "category": "dev-tools",
    "path": "projects/dev-tools/encoding-toolkit/",
    "dateAdded": "2026-07-24T13:52:36+05:30",
    "thumbnailHash": "adbf298c"
  },
  {
    "title": "Feature Flag Playground",
    "category": "dev-tools",
    "path": "projects/dev-tools/feature-flag-playground/",
    "dateAdded": "2026-08-15T15:28:17+05:30",
    "thumbnailHash": "a6dff0dd"
  },
  {
    "title": "File Difference Visualizer",
    "category": "file-tools",
    "path": "projects/file-tools/file-difference-visualizer/",
    "dateAdded": "2026-07-24T02:10:21+05:30",
    "thumbnailHash": "2376a0d1"
  },
  {
    "title": "Flashcard Study",
    "category": "productivity",
    "path": "projects/productivity/flashcard-study/",
    "dateAdded": "2026-08-31T06:39:20+05:30",
    "thumbnailHash": "d7d97a97"
  },
  {
    "title": "Fourier Series Visualizer",
    "category": "math",
    "path": "projects/math/fourier-series-visualizer/",
    "dateAdded": "2026-07-27T16:51:39+05:30",
    "thumbnailHash": "1381d133"
  },
  {
    "title": "Graph Theory Explorer",
    "category": "math",
    "path": "projects/math/graph-theory-explorer/",
    "dateAdded": "2026-07-26T11:42:53+05:30",
    "thumbnailHash": "c3bab7f3"
  },
  {
    "title": "Guitar",
    "category": "instruments",
    "path": "projects/instruments/guitar/",
    "dateAdded": "2026-08-24T10:53:44+05:30",
    "thumbnailHash": "0e04cc09"
  },
  {
    "title": "Guzheng",
    "category": "instruments",
    "path": "projects/instruments/guzheng/",
    "dateAdded": "2026-08-22T10:19:11+05:30",
    "thumbnailHash": "164d1964"
  },
  {
    "title": "Image Classifier",
    "category": "aiml",
    "path": "projects/aiml/image-classifier/",
    "dateAdded": "2026-06-18T16:52:15+05:30",
    "thumbnailHash": "079446f9"
  },
  {
    "title": "Image Metadata Explorer",
    "category": "file-tools",
    "path": "projects/file-tools/image-metadata-explorer/",
    "dateAdded": "2026-08-09T18:35:51+05:30",
    "thumbnailHash": "f380e593"
  },
  {
    "title": "Invoice Generator",
    "category": "productivity",
    "path": "projects/productivity/invoice-generator/",
    "dateAdded": "2026-07-25T23:04:47+05:30",
    "thumbnailHash": "4842d398"
  },
  {
    "title": "JSON Converter",
    "category": "dev-tools",
    "path": "projects/dev-tools/json-converter/",
    "dateAdded": "2026-07-27T16:36:49+05:30",
    "thumbnailHash": "ce36bc20"
  },
  {
    "title": "JSON Tree Viewer",
    "category": "dev-tools",
    "path": "projects/dev-tools/json-tree-viewer/",
    "dateAdded": "2026-08-29T19:03:26+05:30",
    "thumbnailHash": "26a91627"
  },
  {
    "title": "Knowledge Graph",
    "category": "productivity",
    "path": "projects/productivity/knowledge-graph/",
    "dateAdded": "2026-08-31T12:43:04Z",
    "thumbnailHash": "a7ec20d8"
  },
  {
    "title": "Ludo Game",
    "category": "games",
    "path": "projects/games/ludo-game/",
    "dateAdded": "2026-06-19T14:31:47+05:30",
    "thumbnailHash": "cf6e5614"
  },
  {
    "title": "Markdown Editor",
    "category": "editor",
    "path": "projects/editor/markdown-editor/",
    "dateAdded": "2026-08-31T06:31:59+05:30",
    "thumbnailHash": "40e1c608"
  },
  {
    "title": "Markdown Resume Generator",
    "category": "editor",
    "path": "projects/editor/markdown-resume-generator/",
    "dateAdded": "2026-07-24T18:48:37+05:30",
    "thumbnailHash": "b13904c1"
  },
  {
    "title": "Matrix Playground",
    "category": "math",
    "path": "projects/math/matrix-playground/",
    "dateAdded": "2026-07-25T09:01:27+05:30",
    "thumbnailHash": "408ed421"
  },
  {
    "title": "Meme Generator",
    "category": "misc",
    "path": "projects/misc/meme-generator/",
    "dateAdded": "2026-07-08T13:33:11+05:30",
    "thumbnailHash": "8e720301"
  },
  {
    "title": "Memory Flip Game",
    "category": "games",
    "path": "projects/games/memory-flip-game/",
    "dateAdded": "2026-07-02T17:19:22+05:30",
    "thumbnailHash": "3ece0941"
  },
  {
    "title": "Monopoly",
    "category": "games",
    "path": "projects/games/monopoly/",
    "dateAdded": "2026-07-29T16:39:31+05:30",
    "thumbnailHash": "c68c441f"
  },
  {
    "title": "Morse Code Studio",
    "category": "misc",
    "path": "projects/misc/morse-code-studio/",
    "dateAdded": "2026-07-22T09:29:24+05:30",
    "thumbnailHash": "7c0bb565"
  },
  {
    "title": "Neural Network Playground",
    "category": "aiml",
    "path": "projects/aiml/neural-network-playground/",
    "dateAdded": "2026-06-18T16:52:15+05:30",
    "thumbnailHash": "b6ae7f67"
  },
  {
    "title": "Pathfinding Visualizer",
    "category": "math",
    "path": "projects/math/pathfinding-visualizer/",
    "dateAdded": "2026-08-31T12:17:09Z",
    "thumbnailHash": "eda855c2"
  },
  {
    "title": "Percussion",
    "category": "instruments",
    "path": "projects/instruments/percussion/",
    "dateAdded": "2026-08-22T10:04:50+05:30",
    "thumbnailHash": "349d28fa"
  },
  {
    "title": "Periodic Table",
    "category": "misc",
    "path": "projects/misc/periodic-table/",
    "dateAdded": "2026-07-21T11:57:58+05:30",
    "thumbnailHash": "391d9cac"
  },
  {